[
  {
    "id": "bs-1-dean-thomas", "name": "Dean Thomas", "setCode": "BS", "number": "1",
    "types": ["Character"], "subTypes": ["Wizard", "Gryffindor"], "lesson": null, "cost": null,
    "provides": null, "rarity": "Rare", "finishes": ["normal", "holo"], "artist": ["Jon Foster"],
    "stats": null, "orientation": "horizontal", "legality": "unknown", "draftValue": null,
    "rulings": [], "defaultLanguage": "en", "languages": ["en", "de"],
    "localizations": {
      "en": { "name": "Dean Thomas", "status": "official", "source": "WotC", "text": "Draw 3 cards.", "flavorText": "Flavor.", "adventure": null, "match": null, "image": { "file": "DeanThomas.png", "url": null } },
      "de": { "name": "Dean Thomas", "status": "machine", "source": "Claude", "text": "Ziehe 3 Karten.", "flavorText": "Aroma.", "adventure": null, "match": null, "image": { "file": null, "url": null } }
    }
  },
  {
    "id": "bs-2-flobberworm", "name": "Flobberworm", "setCode": "BS", "number": "2",
    "types": ["Creature"], "subTypes": [], "lesson": null, "cost": 2,
    "provides": [{ "lesson": "Charms", "amount": 1 }], "rarity": "Common", "finishes": ["normal"], "artist": ["Artist A"],
    "stats": { "health": 6, "damagePerTurn": null }, "orientation": "vertical", "legality": "legal", "draftValue": 3,
    "rulings": [{ "date": "2001-08-31", "source": "POJO", "ruling": "A ruling." }],
    "defaultLanguage": "en", "languages": ["en"],
    "localizations": {
      "en": { "name": "Flobberworm", "status": "official", "source": "WotC", "text": null, "flavorText": null, "adventure": null, "match": null, "image": { "file": "Flobberworm.png", "url": null } }
    }
  },
  {
    "id": "qc-1-the-snitch", "name": "The Snitch", "setCode": "QC", "number": "1",
    "types": ["Match"], "subTypes": [], "lesson": null, "cost": null,
    "provides": null, "rarity": "Uncommon", "finishes": ["normal"], "artist": [],
    "stats": null, "orientation": "horizontal", "legality": "legal", "draftValue": null,
    "rulings": [], "defaultLanguage": "en", "languages": ["en"],
    "localizations": {
      "en": { "name": "The Snitch", "status": "official", "source": "WotC", "text": null, "flavorText": null, "adventure": null, "match": { "toWin": "Do 10 damage.", "prize": "Draw cards." }, "image": { "file": "Snitch.png", "url": null } }
    }
  }
]
